{
  "cells": [
    {
      "adapter_switch_microseconds": null,
      "batch_size": 1,
      "end_to_end_seconds_median": 3.376496099983342,
      "end_to_end_seconds_min": 3.314520000014454,
      "equivalence_to_dual_sequential": {
        "gradient": {
          "cosine_similarity": 1.0,
          "max_absolute_difference": 0.0,
          "max_relative_to_reference_max": 0.0,
          "relative_l2_difference": 0.0
        },
        "loss_absolute_difference": 0.0,
        "updated_logits": {
          "max_absolute_difference": 0.0,
          "max_relative_to_reference_max": 0.0
        }
      },
      "loss_values": [
        1.9491355055943131,
        1.9491355055943131,
        1.9491355055943131
      ],
      "measurements": [
        {
          "divergence_loss": 1.9491354376077652,
          "end_to_end_seconds": 3.456390800070949,
          "grad_norm": 8.44583797454834,
          "loss": 1.9491355055943131,
          "loss_by_span_type": {
            "assistant_final": 1.824070410522392,
            "assistant_tool_call": 1.887752538415959
          },
          "lr": 0.0001,
          "oracle_ce_loss": null,
          "padded_trajectory_batch_size": 1,
          "peak_allocated_bytes": 2169126400,
          "peak_reserved_bytes": 2738880512,
          "physical_trajectory_batches": 8,
          "sampled_token_nll_loss": null,
          "selected_positions": 863,
          "student_forward_seconds": 0.5857618999434635,
          "teacher_entropy_mean": 0.015114305055293396,
          "teacher_scoring_seconds": 0.6118897000560537,
          "trajectories_in_step": 8,
          "update_seconds": 2.746440399903804
        },
        {
          "divergence_loss": 1.9491354376077652,
          "end_to_end_seconds": 3.376496099983342,
          "grad_norm": 8.44583797454834,
          "loss": 1.9491355055943131,
          "loss_by_span_type": {
            "assistant_final": 1.824070410522392,
            "assistant_tool_call": 1.887752538415959
          },
          "lr": 0.0001,
          "oracle_ce_loss": null,
          "padded_trajectory_batch_size": 1,
          "peak_allocated_bytes": 2169126400,
          "peak_reserved_bytes": 2738880512,
          "physical_trajectory_batches": 8,
          "sampled_token_nll_loss": null,
          "selected_positions": 863,
          "student_forward_seconds": 0.6120747000677511,
          "teacher_entropy_mean": 0.015114305055293396,
          "teacher_scoring_seconds": 0.5925798999378458,
          "trajectories_in_step": 8,
          "update_seconds": 2.7827710999408737
        },
        {
          "divergence_loss": 1.9491354376077652,
          "end_to_end_seconds": 3.314520000014454,
          "grad_norm": 8.44583797454834,
          "loss": 1.9491355055943131,
          "loss_by_span_type": {
            "assistant_final": 1.824070410522392,
            "assistant_tool_call": 1.887752538415959
          },
          "lr": 0.0001,
          "oracle_ce_loss": null,
          "padded_trajectory_batch_size": 1,
          "peak_allocated_bytes": 2169126400,
          "peak_reserved_bytes": 2738880512,
          "physical_trajectory_batches": 8,
          "sampled_token_nll_loss": null,
          "selected_positions": 863,
          "student_forward_seconds": 0.5764589000027627,
          "teacher_entropy_mean": 0.015114305055293396,
          "teacher_scoring_seconds": 0.6027167000574991,
          "trajectories_in_step": 8,
          "update_seconds": 2.7105917999288067
        }
      ],
      "padding_tokens": 0,
      "peak_allocated_bytes": 2169126400,
      "peak_reserved_bytes": 2738880512,
      "physical_batches": 8,
      "runtime": "dual_model",
      "selected_positions": 863,
      "selected_positions_per_second": 255.59040331906726,
      "status": "completed",
      "student_forward_seconds_median": 0.5857618999434635,
      "student_trajectories_per_second": 13.657426337855266,
      "teacher_positions_per_second": 1431.850154338962,
      "teacher_scoring_seconds_median": 0.6027167000574991,
      "teacher_target_digest": "cc761d789a9dc2c17440d03eb72be16c48ff86ffcdceb2b8c10a4745a8f0f995",
      "teacher_target_digests_identical": true,
      "trajectories": 8,
      "trajectories_per_second": 2.369320077117657,
      "trajectory_digest": "5d66d5c903c0633acb5c14898956df654197aebf3df365b972dce6e09c04cf04",
      "update_seconds_median": 2.746440399903804
    },
    {
      "adapter_switch_microseconds": null,
      "batch_size": 2,
      "end_to_end_seconds_median": 2.270638499991037,
      "end_to_end_seconds_min": 2.1587102999910712,
      "equivalence_to_dual_sequential": {
        "gradient": {
          "cosine_similarity": 0.9999999936460533,
          "max_absolute_difference": 3.1676609069108963e-06,
          "max_relative_to_reference_max": 1.2283925701761128e-05,
          "relative_l2_difference": 1.027691608585292e-05
        },
        "loss_absolute_difference": 7.208018359960988e-07,
        "updated_logits": {
          "max_absolute_difference": 7.319450378417969e-05,
          "max_relative_to_reference_max": 2.2267508354304927e-06
        }
      },
      "loss_values": [
        1.9491362263961491,
        1.9491362263961491,
        1.9491362263961491
      ],
      "measurements": [
        {
          "divergence_loss": 1.9491362273693085,
          "end_to_end_seconds": 2.3138189000310376,
          "grad_norm": 8.44585132598877,
          "loss": 1.9491362263961491,
          "loss_by_span_type": {
            "assistant_final": 1.8240704259762848,
            "assistant_tool_call": 1.8877531072721814
          },
          "lr": 0.0001,
          "oracle_ce_loss": null,
          "padded_trajectory_batch_size": 2,
          "peak_allocated_bytes": 2445559296,
          "peak_reserved_bytes": 3105882112,
          "physical_trajectory_batches": 4,
          "sampled_token_nll_loss": null,
          "selected_positions": 863,
          "student_forward_seconds": 0.383002300048247,
          "teacher_entropy_mean": 0.015114305055293396,
          "teacher_scoring_seconds": 0.6062203000765294,
          "trajectories_in_step": 8,
          "update_seconds": 1.5902763999765739
        },
        {
          "divergence_loss": 1.9491362273693085,
          "end_to_end_seconds": 2.270638499991037,
          "grad_norm": 8.44585132598877,
          "loss": 1.9491362263961491,
          "loss_by_span_type": {
            "assistant_final": 1.8240704259762848,
            "assistant_tool_call": 1.8877531072721814
          },
          "lr": 0.0001,
          "oracle_ce_loss": null,
          "padded_trajectory_batch_size": 2,
          "peak_allocated_bytes": 2445559296,
          "peak_reserved_bytes": 3105882112,
          "physical_trajectory_batches": 4,
          "sampled_token_nll_loss": null,
          "selected_positions": 863,
          "student_forward_seconds": 0.4471722999587655,
          "teacher_entropy_mean": 0.015114305055293396,
          "teacher_scoring_seconds": 0.631529500009492,
          "trajectories_in_step": 8,
          "update_seconds": 1.6374873999739066
        },
        {
          "divergence_loss": 1.9491362273693085,
          "end_to_end_seconds": 2.1587102999910712,
          "grad_norm": 8.44585132598877,
          "loss": 1.9491362263961491,
          "loss_by_span_type": {
            "assistant_final": 1.8240704259762848,
            "assistant_tool_call": 1.8877531072721814
          },
          "lr": 0.0001,
          "oracle_ce_loss": null,
          "padded_trajectory_batch_size": 2,
          "peak_allocated_bytes": 2445559296,
          "peak_reserved_bytes": 3105882112,
          "physical_trajectory_batches": 4,
          "sampled_token_nll_loss": null,
          "selected_positions": 863,
          "student_forward_seconds": 0.3980319000547752,
          "teacher_entropy_mean": 0.015114305055293396,
          "teacher_scoring_seconds": 0.651307399966754,
          "trajectories_in_step": 8,
          "update_seconds": 1.5059746000915766
        }
      ],
      "padding_tokens": 270,
      "peak_allocated_bytes": 2445559296,
      "peak_reserved_bytes": 3105882112,
      "physical_batches": 4,
      "runtime": "dual_model",
      "selected_positions": 863,
      "selected_positions_per_second": 380.06930649832924,
      "status": "completed",
      "student_forward_seconds_median": 0.3980319000547752,
      "student_trajectories_per_second": 20.09889156848755,
      "teacher_positions_per_second": 1366.523654060545,
      "teacher_scoring_seconds_median": 0.631529500009492,
      "teacher_target_digest": "cc761d789a9dc2c17440d03eb72be16c48ff86ffcdceb2b8c10a4745a8f0f995",
      "teacher_target_digests_identical": true,
      "trajectories": 8,
      "trajectories_per_second": 3.523238067191928,
      "trajectory_digest": "5d66d5c903c0633acb5c14898956df654197aebf3df365b972dce6e09c04cf04",
      "update_seconds_median": 1.5902763999765739
    },
    {
      "adapter_switch_microseconds": null,
      "batch_size": 4,
      "end_to_end_seconds_median": 2.0693016999866813,
      "end_to_end_seconds_min": 2.0502641999628395,
      "equivalence_to_dual_sequential": {
        "gradient": {
          "cosine_similarity": 0.9999999955807889,
          "max_absolute_difference": 4.25335019826889e-06,
          "max_relative_to_reference_max": 1.6494138531405533e-05,
          "relative_l2_difference": 1.4381439053714819e-05
        },
        "loss_absolute_difference": 5.569308996200562e-07,
        "updated_logits": {
          "max_absolute_difference": 0.00011301040649414062,
          "max_relative_to_reference_max": 3.4380452638242786e-06
        }
      },
      "loss_values": [
        1.9491360625252128,
        1.9491360625252128,
        1.9491360625252128
      ],
      "measurements": [
        {
          "divergence_loss": 1.949136033654213,
          "end_to_end_seconds": 2.339139699935913,
          "grad_norm": 8.445860862731934,